案類,發生日期,發生時段,發生地點
住宅竊盜,1030623,08~10,臺北市中正區廈門街91~120號
住宅竊盜,1040101,00~02,臺北市文山區萬美里萬寧街1~30號
住宅竊盜,1040101,00~02,臺北市信義區富台里忠孝東路5段295巷6弄1~30號
住宅竊盜,1040101,06~08,臺北市中山區新生北路1段91~120號
住宅竊盜,1040101,10~12,臺北市文山區明興里興隆路4段1~30號
住宅竊盜,1040102,00~02,臺北市士林區天福里1鄰忠誠路2段130巷1~30號
住宅竊盜,1040102,06~08,臺北市萬華區糖?里大理街159巷1~30號
住宅竊盜,1040102,06~08,臺北市萬華區糖?里大理街159巷1~30號
住宅竊盜,1040102,10~12,臺北市中山區吉林路121~150號
住宅竊盜,1040104,10~12,臺北市信義區五常里永吉路225巷32弄1~30號
住宅竊盜,1040104,12~14,臺北市士林區明勝里通河街31~60號
住宅竊盜,1040105,00~02,臺北市中山區南京東路3段181~210號
住宅竊盜,1040105,04~06,臺北市萬華區大理街159巷1~30號
住宅竊盜,1040105,04~06,臺北市萬華區糖?里大理街159巷1~30號
住宅竊盜,1040105,12~14,臺北市北投區吉慶里實踐街56巷1~30號
住宅竊盜,1040105,16~18,臺北市中正區忠勤里中華路2段311巷1~30號
住宅竊盜,1040105,18~20,臺北市文山區興福里12鄰景華街61~90號
住宅竊盜,1040106,04~06,臺北市信義區雅祥里基隆路1段1~30號
住宅竊盜,1040106,16~18,臺北市中正區水源里汀州路3段91~120號
住宅竊盜,1040107,16~18,臺北市文山區萬芳里萬芳路31~60號
住宅竊盜,1040108,08~10,臺北市文山區萬美里萬美街1段61~90號
住宅竊盜,1040109,10~12,臺北市內湖區港華里港華街1~30號
住宅竊盜,1040109,12~14,臺北市中山區樂群二路91~120號
住宅竊盜,1040109,16~18,臺北市松山區民權東路3段106巷1~30號
住宅竊盜,1040110,04~06,臺北市信義區福德街373巷91~120號
住宅竊盜,1040111,08~10,臺北市萬華區萬大路387巷1~30號
住宅竊盜,1040112,08~10,臺北市大安區龍雲里4鄰大安路2段132巷1~30號
住宅竊盜,1040112,18~20,臺北市松山區光復南路22巷31~60號
住宅竊盜,1040112,20~22,臺北市松山區健康路325巷18弄1~30號
住宅竊盜,1040113,10~12,臺北市萬華區青年路31~60號
住宅竊盜,1040114,08~10,臺北市松山區富錦街572巷1~30號
住宅竊盜,1040114,16~18,臺北市萬華區和平西路3段382巷2弄1~30號
住宅竊盜,1040115,00~02,臺北市松山區饒河街181~210號
住宅竊盜,1040115,06~08,臺北市南港區舊莊街1段290巷1弄1~30號
住宅竊盜,1040115,06~08,臺北市南港區九如里研究院路3段18巷1~30號
住宅竊盜,1040115,10~12,臺北市內湖區民權東路6段296巷91~120號
住宅竊盜,1040115,12~14,臺北市大安區市民大道4段1~30號
住宅竊盜,1040116,10~12,臺北市松山區敦化南路2段31~60號
住宅竊盜,1040117,08~10,臺北市信義區國業里松德路25巷31~60號
住宅竊盜,1040117,12~14,臺北市文山區明義里興隆路4段46巷31~60號
住宅竊盜,1040117,18~20,臺北市中正區羅斯福路4段52巷1~30號
住宅竊盜,1040117,18~20,臺北市中正區羅斯福路4段52巷1~30號
住宅竊盜,1040118,02~04,臺北市萬華區桂林路242巷1~30號
住宅竊盜,1040118,06~08,臺北市萬華區西園路2段320巷61~90號
住宅竊盜,1040118,10~12,臺北市大安區通化里通化街19巷1~30號
住宅竊盜,1040118,20~22,臺北市信義區富台里忠孝東路5段295巷6弄31~60號
住宅竊盜,1040119,06~08,臺北市大同區蓬萊里昌吉街50巷1~30號
住宅竊盜,1040120,18~20,臺北市南港區三重里重陽路511~540號
住宅竊盜,1040121,08~10,臺北市萬華區柳鄉里1鄰桂林路242巷6弄1~30號
住宅竊盜,1040121,20~22,臺北市中山區吉林路379巷1~30號
住宅竊盜,1040121,20~22,臺北市士林區百齡里21鄰通河東街1段61~90號
住宅竊盜,1040121,22~24,臺北市中山區中山北路1段53巷1~30號
住宅竊盜,1040122,10~12,臺北市大同區揚雅里承德路3段90巷1~30號
住宅竊盜,1040122,16~18,臺北市大安區龍安里青田街5巷1~30號
住宅竊盜,1040123,14~16,臺北市中山區北安路571~600號
住宅竊盜,1040123,14~16,臺北市中正區龍光里和平西路2段1~30號
住宅竊盜,1040123,18~20,臺北市文山區萬興里21鄰秀明路2段115巷1~30號
住宅竊盜,1040124,10~12,臺北市萬華區梧州街60巷1~30號
住宅竊盜,1040126,02~04,臺北市萬華區民和街55巷1~30號
住宅竊盜,1040126,08~10,臺北市大同區酒泉街103巷1~30號
住宅竊盜,1040126,18~20,臺北市中正區水源里羅斯福路4段91~120號
住宅竊盜,1040126,20~22,臺北市內湖區西康里4鄰文湖街11巷1~30號
住宅竊盜,1040127,02~04,臺北市中山區中山北路2段1~30號
住宅竊盜,1040127,06~08,臺北市中山區民生東路3段9巷1~30號
住宅竊盜,1040127,10~12,臺北市文山區景興路238巷1~30號
住宅竊盜,1040127,10~12,臺北市文山區景興路238巷1~30號
住宅竊盜,1040127,14~16,臺北市南港區東明里興華路64巷1~30號
住宅竊盜,1040127,16~18,臺北市大安區錦泰里15鄰金山南路2段121~150號
住宅竊盜,1040127,16~18,臺北市文山區景興路238巷1~30號
住宅竊盜,1040128,14~16,臺北市內湖區東湖里康樂街48巷18~1號
住宅竊盜,1040129,12~14,臺北市松山區延壽街121~150號
住宅竊盜,1040129,12~14,臺北市信義區富台里忠孝東路5段423巷5弄1~30號
住宅竊盜,1040130,12~14,臺北市信義區廣居里忠孝東路5段372巷27弄61~90號
住宅竊盜,1040131,00~02,臺北市南港區重陽路57巷1~30號
住宅竊盜,1040201,00~02,臺北市北投區中心里中和街31~60號
住宅竊盜,1040201,10~12,臺北市松山區敦化北路199巷100弄1~30號
住宅竊盜,1040201,10~12,臺北市北投區雙全街62巷1~30號
住宅竊盜,1040201,18~20,臺北市信義區信義路6段15巷1~30號
住宅竊盜,1040202,08~10,臺北市中正區網溪里廈門街91~120號
住宅竊盜,1040202,20~22,臺北市北投區中心里中和街31~60號
住宅竊盜,1040203,04~06,臺北市文山區木新里木新路2段161巷1~30號
住宅竊盜,1040204,18~20,臺北市中山區農安街125巷1~30號
住宅竊盜,1040205,02~04,臺北市士林區百齡里福港街211~240號
住宅竊盜,1040205,04~06,臺北市內湖區樂康里康樂街111巷31~60號
住宅竊盜,1040205,14~16,臺北市萬華區大理街170巷1~30號
住宅竊盜,1040206,08~10,臺北市中山區合江街20巷1~30號
住宅竊盜,1040206,16~18,臺北市內湖區西湖里內湖路1段285巷69弄91~120號
住宅竊盜,1040207,04~06,臺北市信義區黎安里和平東路路3段571~600號
住宅竊盜,1040207,22~24,臺北市中正區三愛里新生南路1段121~150號
住宅竊盜,1040208,04~06,臺北市大安區新龍里信義路3段134巷91~120號
住宅竊盜,1040209,02~04,臺北市文山區忠順里忠順街2段1~30號
住宅竊盜,1040210,00~02,臺北市北投區大同路200巷1~30號
住宅竊盜,1040210,10~12,臺北市士林區福志里志成路22巷15弄1~30號
住宅竊盜,1040211,16~18,臺北市內湖區葫洲里民權東路6段296巷38之1~30號
住宅竊盜,1040212,00~02,臺北市萬華區萬大路493巷48弄1~30號
住宅竊盜,1040212,02~04,臺北市松山區撫遠街241~270號
住宅竊盜,1040212,12~14,臺北市信義區松隆里松山路615巷1~30號
住宅竊盜,1040212,20~22,臺北市文山區興安里22鄰景華街176巷7~1號
住宅竊盜,1040213,04~06,臺北市中山區八德路2段210巷1~30號
住宅竊盜,1040213,08~10,臺北市中山區農安街1~30號
住宅竊盜,1040214,08~10,臺北市士林區明勝里承德路4段12巷61~90號
住宅竊盜,1040215,08~10,臺北市中山區長安東路2段1~30號
住宅竊盜,1040215,08~10,臺北市大安區法治里通化街173巷1~30號
住宅竊盜,1040215,12~14,臺北市北投區吉利里20鄰石牌路1段39巷61~90號
住宅竊盜,1040215,22~24,臺北市信義區和平東路3段661~690號
住宅竊盜,1040216,00~02,臺北市信義區吳興街269巷1~30號
住宅竊盜,1040216,12~14,臺北市中正區文盛里羅斯福路3段210巷8弄1~30號
住宅竊盜,1040216,14~16,臺北市內湖區新明路246巷3弄1~30號
住宅竊盜,1040216,18~20,臺北市內湖區西湖里內湖路1段91巷121~150號
住宅竊盜,1040216,22~24,臺北市松山區南京東路5段211~240號
住宅竊盜,1040216,22~24,臺北市中山區南京路三民1號
住宅竊盜,1040218,06~08,臺北市大同區民權里民權西路160巷30弄1~30號
住宅竊盜,1040219,12~14,臺北市信義區黎忠里和平東路3段391巷8弄31~60號
住宅竊盜,1040219,18~20,臺北市北投區文林里致遠一路1段125巷1~30號
住宅竊盜,1040219,18~20,臺北市信義區四育里虎林街46巷1~30號
住宅竊盜,1040219,20~22,臺北市信義區四育里虎林街46巷1~30號
住宅竊盜,1040220,06~08,臺北市北投區文林里致遠一路1段31~60號
住宅竊盜,1040221,18~20,臺北市大安區通化里17鄰通化街39巷62弄1~30號
住宅竊盜,1040222,02~04,臺北市文山區樟新里樟新街32巷1~30號
住宅竊盜,1040223,00~02,臺北市士林區義信里大南路61~90號
住宅竊盜,1040223,12~14,臺北市南港區中南里中南街74巷31~60號
住宅竊盜,1040223,14~16,臺北市信義區大仁里福德街84巷1弄1~30號
住宅竊盜,1040223,20~22,臺北市士林區蘭雅里德行東路31~60號
住宅竊盜,1040224,12~14,臺北市萬華區萬大路493巷48弄1~30號
住宅竊盜,1040224,16~18,臺北市北投區中心里8鄰泉源路31~60號
住宅竊盜,1040224,20~22,臺北市內湖區西湖里26鄰內湖路1段285巷65弄61~90號
住宅竊盜,1040225,04~06,臺北市中正區黎明里南陽街1~30號
住宅竊盜,1040225,08~10,臺北市士林區聖山里忠誠路1段147巷1~30號
住宅竊盜,1040225,10~12,臺北市南港區舊莊里舊莊街1段145巷6弄1~30號
住宅竊盜,1040226,02~04,臺北市大安區義安里敦化南路2段63巷31~60號
住宅竊盜,1040226,14~16,臺北市中正區幸市里臨沂街33巷1~30號
住宅竊盜,1040226,20~22,臺北市內湖區西湖里內湖路1段323巷14弄1~30號
住宅竊盜,1040227,00~02,臺北市萬華區西寧南路206巷1~30號
住宅竊盜,1040227,02~04,臺北市萬華區西園路2段151~180號
住宅竊盜,1040227,10~12,臺北市北投區中央里大興街24巷7弄1~30號
住宅竊盜,1040228,20~22,臺北市內湖區週美里新明路3800巷4弄1~30號
住宅竊盜,1040228,20~22,臺北市萬華區東園街73巷61~90號
住宅竊盜,1040302,08~10,臺北市松山區八德路4段106巷6弄1~30號
住宅竊盜,1040304,00~02,臺北市北投區福興里自強街5巷61~90號
住宅竊盜,1040304,16~18,臺北市士林區社新里延平北路6段273巷1~30號
住宅竊盜,1040304,16~18,臺北市內湖區湖興里成功路2段312巷31~60號
住宅竊盜,1040305,04~06,臺北市北投區吉慶里11鄰致遠二路1~30號
住宅竊盜,1040305,04~06,臺北市萬華區和平西路3段55巷8弄1~30號
住宅竊盜,1040305,14~16,臺北市內湖區葫洲里2鄰民權東路6段280巷25弄6之1~30號
住宅竊盜,1040306,04~06,臺北市松山區八德路3段121~150號
住宅竊盜,1040306,20~22,臺北市大安區建安里忠孝東路4段181巷40弄1~30號
住宅竊盜,1040307,04~06,臺北市北投區大同里大業路481~510號
住宅竊盜,1040308,16~18,臺北市萬華區內江街151~180號
住宅竊盜,1040308,22~24,臺北市萬華區中華路2段416巷1~30號
住宅竊盜,1040309,04~06,臺北市文山區萬盛里羅斯福路5段61~90號
住宅竊盜,1040310,00~02,臺北市士林區天母里中山北路7段219巷1~30號
住宅竊盜,1040310,00~02,臺北市松山區八德路4段106巷10弄1~30號
住宅竊盜,1040310,12~14,臺北市萬華區昆明街211~240號
住宅竊盜,1040310,12~14,臺北市萬華區昆明街211~240號
住宅竊盜,1040311,08~10,臺北市中山區新生北路22段58巷1~30號
住宅竊盜,1040312,00~02,臺北市中正區水源里羅斯福路4段61~90號
住宅竊盜,1040312,10~12,臺北市大同區至聖里大龍街259巷10弄1~30號
住宅竊盜,1040312,16~18,臺北市大安區古莊里浦城街13巷1~30號
住宅竊盜,1040313,02~04,臺北市北投區中庸里10鄰大同街181~210號
住宅竊盜,1040313,22~24,臺北市中山區松江路37巷1~30號
住宅竊盜,1040314,02~04,臺北市文山區試院里和興路91~120號
住宅竊盜,1040315,02~04,臺北市萬華區長泰街271~300號
住宅竊盜,1040316,02~04,臺北市萬華區中華路1段181~210號
住宅竊盜,1040316,08~10,臺北市中正區螢雪里水源路151~180號
住宅竊盜,1040317,00~02,臺北市北投區榮華里17鄰明德路118巷1~30號
住宅竊盜,1040317,12~14,臺北市南港區萬福里同德路50巷1~30號
住宅竊盜,1040319,12~14,臺北市文山區萬和里溪洲街61~90號
住宅竊盜,1040319,22~24,臺北市北投區永和里同德街44巷1~30號
住宅竊盜,1040320,12~14,臺北市萬華區糖?里大理街160巷26弄1~30號
住宅竊盜,1040320,18~20,臺北市松山區南京東路5段23巷7弄1~30號
住宅竊盜,1040320,18~20,臺北市萬華區漢口街2段61~90號
住宅竊盜,1040324,06~08,臺北市北投區永明里石牌路2段97巷1~30號
住宅竊盜,1040324,08~10,臺北市松山區民權東路3段153巷3弄1~30號
住宅竊盜,1040324,10~12,臺北市萬華區東園街85巷4弄1~30號
住宅竊盜,1040325,12~14,臺北市中正區文祥里金山南路1段79巷1~30號
住宅竊盜,1040325,14~16,臺北市大安區龍門里10鄰和平東路2段18巷13弄1~30號
住宅竊盜,1040325,22~24,臺北市中山區合江街61~90號
住宅竊盜,1040326,16~18,臺北市文山區興福里1鄰興隆路1段260巷1~30號
住宅竊盜,1040327,18~20,臺北市文山區萬隆里羅斯福路5段241~270號
住宅竊盜,1040327,18~20,臺北市信義區黎平里和平東路3段207巷6弄1~30號
住宅竊盜,1040328,10~12,臺北市中山區民權東路3段1~30號
住宅竊盜,1040329,08~10,臺北市松山區南京東路5段31~60號
住宅竊盜,1040330,08~10,臺北市中山區松江路332﹑334號
住宅竊盜,1040330,10~12,臺北市士林區平等里平菁街105巷1~30號
住宅竊盜,1040330,12~14,臺北市文山區萬利街2巷1~30號
住宅竊盜,1040331,08~10,臺北市內湖區金瑞里金龍路1~30號
住宅竊盜,1040331,22~24,臺北市萬華區萬大路493巷28弄1~30號
住宅竊盜,1040401,00~02,臺北市中山區長春路241~270號
住宅竊盜,1040401,12~14,臺北市士林區新安里新安路241~270號
住宅竊盜,1040401,12~14,臺北市士林區天壽里5鄰天母西路22巷1~30號
住宅竊盜,1040404,12~14,臺北市文山區木新里指南路1段31~60號
住宅竊盜,1040404,20~22,臺北市松山區饒河街61~90號
住宅竊盜,1040405,12~14,臺北市文山區指南里指南路3段22巷1~30號
住宅竊盜,1040405,20~22,臺北市松山區光復北路31~60號
住宅竊盜,1040405,22~24,臺北市內湖區港富里麗山街328巷1~30號
住宅竊盜,1040405,22~24,臺北市大同區南芳里延平北路2段241~270號
住宅竊盜,1040407,02~04,臺北市萬華區雅江街31~60號
住宅竊盜,1040407,10~12,臺北市中山區大直街84巷1~30號
住宅竊盜,1040407,10~12,臺北市內湖區紫陽里文德路22巷59弄1~30號
住宅竊盜,1040408,12~14,臺北市中正區螢雪里重慶南路3段74巷1~30號
住宅竊盜,1040409,10~12,臺北市中山區農安街1~30號
住宅竊盜,1040410,06~08,臺北市北投區吉利里23鄰吉利街320巷1弄1~30號
住宅竊盜,1040410,16~18,臺北市萬華區忠德里4鄰寶興街91~120號
住宅竊盜,1040410,20~22,臺北市松山區民生東路5段181~210號
住宅竊盜,1040411,10~12,臺北市內湖區內湖路1段359巷1~30號
住宅竊盜,1040413,10~12,臺北市北投區智仁里杏林二路28巷1~30號
住宅竊盜,1040413,12~14,臺北市萬華區貴陽街2段151~180號
住宅竊盜,1040413,16~18,臺北市大同區永樂里甘谷街1~30號
住宅竊盜,1040415,00~02,臺北市萬華區富民里4鄰貴陽街2段151~180號
住宅竊盜,1040415,08~10,臺北市松山區民生東路4段55巷1~30號
住宅竊盜,1040415,16~18,臺北市萬華區西園路2段261巷31~60號
住宅竊盜,1040416,06~08,臺北市文山區萬和里1鄰溪州街137巷61~90號
住宅竊盜,1040416,06~08,臺北市士林區三玉里忠誠路2段41巷1~30號
住宅竊盜,1040416,12~14,臺北市中山區中山北路2段93巷1~30號
住宅竊盜,1040416,14~16,臺北市內湖區康樂街61巷12弄1~30號
住宅竊盜,1040416,14~16,臺北市北投區永欣里石牌路2段181~210號
住宅竊盜,1040416,20~22,臺北市南港區舊莊里舊莊街1段145巷6弄1~30號
住宅竊盜,1040417,18~20,臺北市北投區奇岩里奇岩路31~60號
住宅竊盜,1040417,18~20,臺北市中山區建國北路3段22巷1~30號
住宅竊盜,1040419,14~16,臺北市北投區榮華里榮華一路15巷1~30號
住宅竊盜,1040420,12~14,臺北市內湖區五分街61~90號
住宅竊盜,1040420,16~18,臺北市內湖區瑞光里瑞光路235巷1~30號
住宅竊盜,1040420,22~24,臺北市中山區遼寧街241~270號
住宅竊盜,1040421,18~20,臺北市文山區指南里15鄰指南路3段26巷1~30號
住宅竊盜,1040422,18~20,臺北市松山區撫遠街181~210號
住宅竊盜,1040422,20~22,臺北市萬華區萬大路493巷12弄1~30號
住宅竊盜,1040423,04~06,臺北市內湖區康樂街136巷15弄1~30號
住宅竊盜,1040423,08~10,臺北市松山區南京東路5段211~240號
住宅竊盜,1040423,14~16,臺北市內湖區樂康里康樂街136巷15弄1~30號
住宅竊盜,1040423,18~20,臺北市士林區仁勇里16鄰大東路121~150號
住宅竊盜,1040423,20~22,臺北市萬華區環河南路2段250巷3弄1~30號
住宅竊盜,1040424,10~12,臺北市內湖區樂康里康樂街72巷17弄121~150號
住宅竊盜,1040425,00~02,臺北市大同區揚雅里民族西路151~180號
住宅竊盜,1040425,04~06,臺北市文山區興業里23鄰辛亥路5段124巷1~30號
住宅竊盜,1040426,04~06,臺北市北投區智仁里21鄰中和街525巷10弄1~30號
住宅竊盜,1040427,06~08,臺北市中山區大直街62巷5弄1~30號
住宅竊盜,1040427,08~10,臺北市內湖區湖興里20鄰成功路2段250巷31~60號
住宅竊盜,1040427,12~14,臺北市文山區興隆路2段154巷1~30號
住宅竊盜,1040427,14~16,臺北市中山區大直街62巷5弄1~30號
住宅竊盜,1040427,18~20,臺北市萬華區德昌街132巷1~30號
住宅竊盜,1040427,22~24,臺北市內湖區港都里港華街85巷1~30號
住宅竊盜,1040428,20~22,臺北市萬華區西藏路481~510號
住宅竊盜,1040429,12~14,臺北市中山區敬業三路162巷121~150號
住宅竊盜,1040429,14~16,臺北市中山區敬業三路162巷31~60號
住宅竊盜,1040430,08~10,臺北市內湖區麗山街328巷1~30號
住宅竊盜,1040430,18~20,臺北市內湖區樂康里康樂街136巷18弄31~60號
住宅竊盜,1040501,00~02,臺北市信義區忠孝東路
住宅竊盜,1040501,14~16,臺北市松山區民生東路5段181~210號
住宅竊盜,1040501,16~18,臺北市中山區吉林路379巷1~30號
住宅竊盜,1040503,00~02,臺北市中山區農安街1~30號
住宅竊盜,1040503,12~14,臺北市松山區撫遠街391~420號
住宅竊盜,1040503,18~20,臺北市松山區寶清街104巷31~60號
住宅竊盜,1040504,10~12,臺北市中山區長安東路1段31~60號
住宅竊盜,1040504,18~20,臺北市內湖區西湖里內湖路1段323巷1~30號
住宅竊盜,1040505,10~12,臺北市南港區舊莊里舊莊街1段145巷6弄1~30號
住宅竊盜,1040505,18~20,臺北市士林區菁山里永公路511~540號
住宅竊盜,1040506,20~22,臺北市文山區試院里29鄰木柵路1段1~30號
住宅竊盜,1040507,20~22,臺北市信義區大道里大道路7巷1弄1~30號
住宅竊盜,1040508,06~08,臺北市大同區斯文里大龍街89巷1~30號
住宅竊盜,1040508,08~10,臺北市大安區車層里忠孝東路4段216巷19弄1~30號
住宅竊盜,1040508,14~16,臺北市北投區大屯里復興三路521巷1~30號
住宅竊盜,1040509,12~14,臺北市士林區聖山里20鄰忠義街46巷1~30號
住宅竊盜,1040510,04~06,臺北市大安區虎嘯里樂業街15巷1~30號
住宅竊盜,1040510,12~14,臺北市內湖區新明路380巷9弄1~30號
住宅竊盜,1040510,14~16,臺北市中山區中山北路1段91~120號
住宅竊盜,1040511,22~24,臺北市萬華區萬大路322巷55弄1~30號
住宅竊盜,1040512,10~12,臺北市北投區開明里珠海路107巷1~30號
住宅竊盜,1040512,12~14,臺北市中正區文祥里金山南路一段91~120號
住宅竊盜,1040512,20~22,臺北市松山區延壽街61~90號
住宅竊盜,1040513,16~18,臺北市松山區健康路7巷1~30號
住宅竊盜,1040513,20~22,臺北市信義區五全里永吉路181~210號
住宅竊盜,1040514,10~12,臺北市內湖區康寧路3段245巷31~60號
住宅竊盜,1040514,12~14,臺北市文山區樟新里木新路3段301~330號
住宅竊盜,1040515,06~08,臺北市萬華區中華路2段481~510號
住宅竊盜,1040515,12~14,臺北市內湖區麗山街46巷5弄1~30號
住宅竊盜,1040515,12~14,臺北市內湖區康寧路1段156巷7弄1~30號
住宅竊盜,1040515,18~20,臺北市北投區榮光里致遠一路2段40巷1弄1~30號
住宅竊盜,1040518,12~14,臺北市中正區黎明里信陽街1~30號
住宅竊盜,1040518,14~16,臺北市萬華區東園街66巷1~30號
住宅竊盜,1040521,18~20,臺北市北投區文化里文化三路1~30號
住宅竊盜,1040521,22~24,臺北市士林區福志里24鄰中山北路5段756巷1~30號
住宅竊盜,1040522,18~20,臺北市中正區板溪里南昌路2段91~120號
住宅竊盜,1040523,10~12,臺北市松山區南京東路5段291巷44弄1~30號
住宅竊盜,1040523,10~12,臺北市松山區南京東路5段59巷28弄1~30號
住宅竊盜,1040525,20~22,臺北市文山區試院里木柵路1段31~60號
住宅竊盜,1040526,06~08,臺北市北投區洲美里洲美街81巷1~30號
住宅竊盜,1040526,16~18,臺北市中山區錦州街181~210號
住宅竊盜,1040526,22~24,臺北市中山區林森北路119巷1~30號
住宅竊盜,1040528,06~08,臺北市文山區萬祥里興隆路1段70巷1~30號
住宅竊盜,1040528,20~22,臺北市士林區永倫里6鄰社中街426巷1~30號
住宅竊盜,1040529,16~18,臺北市大同區斯文里承德路3段85巷1~30號
住宅竊盜,1040529,22~24,臺北市大同區南京西路31~60號
住宅竊盜,1040530,10~12,臺北市松山區民生東路5段36巷6弄1~30號
住宅竊盜,1040531,22~24,臺北市文山區興得里興隆路3段192巷8弄31~60號
住宅竊盜,1040531,22~24,臺北市信義區大道里林口街151~180號
住宅竊盜,1040601,00~02,臺北市中山區八德路2段241~270號
住宅竊盜,1040602,14~16,臺北市北投區泉源里東昇路91~120號
住宅竊盜,1040603,00~02,臺北市中正區光復里7號
住宅竊盜,1040603,16~18,臺北市中山區長安東路2段31~60號
住宅竊盜,1040604,14~16,臺北市中山區樂群二路181~210號
住宅竊盜,1040606,04~06,臺北市中山區錦州街31~60號
住宅竊盜,1040606,12~14,臺北市松山區南京東路5段123巷8弄1~30號
住宅竊盜,1040606,20~22,臺北市松山區八德路3段12巷52弄1~30號
住宅竊盜,1040607,06~08,臺北市中山區中山北路2段65巷2弄1~30號
住宅竊盜,1040607,10~12,臺北市中山區農安街125巷1~30號
住宅竊盜,1040607,12~14,臺北市大安區民炤里新生南路1段137巷1~30號
住宅竊盜,1040608,06~08,臺北市中正區黎明里懷寧街61~90號
住宅竊盜,1040608,08~10,臺北市中山區民權東路1段31~60號
住宅竊盜,1040608,14~16,臺北市士林區福林里中山北路5段460巷1~30號
住宅竊盜,1040608,22~24,臺北市中山區長春路61~90號
住宅竊盜,1040609,16~18,臺北市文山區試院里和興路91~120號
住宅竊盜,1040611,20~22,臺北市萬華區桂林路242巷31~60號
住宅竊盜,1040612,10~12,臺北市信義區三張里莊敬路391~420號
住宅竊盜,1040613,12~14,臺北市中山區新生北路3段31~60號
住宅竊盜,1040613,16~18,臺北市中正區板溪里羅斯福路3段84巷1弄1~30號
住宅竊盜,1040615,00~02,臺北市文山區萬芳里011鄰萬安街61~90號
住宅竊盜,1040615,02~04,臺北市信義區永吉路120巷31~60號
住宅竊盜,1040615,12~14,臺北市中山區建國北路2段116巷1~30號
住宅竊盜,1040616,08~10,臺北市萬華區西藏路199巷1~30號
住宅竊盜,1040616,12~14,臺北市文山區景東里景華街104巷1~30號
住宅竊盜,1040616,14~16,臺北市文山區景東里景興路153巷14弄1~30號
住宅竊盜,1040619,08~10,臺北市文山區萬隆里羅斯福路5段241~270號
住宅竊盜,1040619,08~10,臺北市中山區長安東路1段52巷9弄1~30號
住宅竊盜,1040619,18~20,臺北市中正區頂東里羅斯福路2段174巷1~30號
住宅竊盜,1040620,06~08,臺北市松山區光復北路120巷121~150號
住宅竊盜,1040620,10~12,臺北市信義區富陽街44巷1~30號
住宅竊盜,1040621,10~12,臺北市士林區溪山里至善路3段1~30號
住宅竊盜,1040622,06~08,臺北市北投區八仙里承德路7段401巷331弄1~30號
住宅竊盜,1040622,12~14,臺北市士林區臨溪里故宮路41巷1~30號
住宅竊盜,1040622,14~16,臺北市士林區臨溪里5鄰故宮路41巷1~30號
住宅竊盜,1040623,22~24,臺北市大安區大安路1段16巷1~30號
住宅竊盜,1040624,04~06,臺北市中山區新生北路3段1~30號
住宅竊盜,1040624,18~20,臺北市中正區光復里重慶南路1段1~30號
住宅竊盜,1040625,00~02,臺北市中山區明水路601~630號
住宅竊盜,1040628,00~02,臺北市中山區中山北路2段128巷6弄1~30號
住宅竊盜,1040628,00~02,臺北市中山區林森北路391~420號
住宅竊盜,1040628,02~04,臺北市士林區陽明里華岡路31~60號
住宅竊盜,1040628,16~18,臺北市南港區玉成里南港路3段130巷3弄1~30號
住宅竊盜,1040628,16~18,臺北市內湖區東湖路113巷95弄121~150號
住宅竊盜,1040630,00~02,臺北市信義區六張捷運站
住宅竊盜,1040630,04~06,臺北市北投區湖山里建國街1~30號
住宅竊盜,1040630,10~12,臺北市中山區民生東路2段121~150號
住宅竊盜,1040630,22~24,臺北市北投區林泉里新民路61~90號
住宅竊盜,1040701,00~02,臺北市中山區農安街28之1~30號
住宅竊盜,1040701,08~10,臺北市中正區羅斯福路3段91~120號
